# Time-series surface: create/insert/select, OOO drop reporting (v0.126.0),
# label-DISTINCT from series metadata (v0.130.0), COUNT(*) via partials
# (v0.131.0), ts_bucketed aggregation.

statement ok
CREATE TIMESERIES TABLE m (SERIES KEY (host), RETENTION 30d, OOO 2m)

statement ok
INSERT INTO m (host, ts, value) VALUES ('a', 60000, 1), ('a', 600000, 2), ('b', 60000, 5)

# A point far outside the OOO window is dropped AND SAYS SO (affected 0).
statement count 0
INSERT INTO m (host, ts, value) VALUES ('a', 1, 9)

query IR
SELECT ts, value FROM m WHERE host = 'a' ORDER BY ts
----
60000 1.000
600000 2.000

query I
SELECT count(*) FROM m
----
3

query T rowsort
SELECT DISTINCT host FROM m
----
a
b

query TI rowsort
SELECT host, count(*) FROM m GROUP BY host
----
a 2
b 1

query R
SELECT sum(value) FROM m WHERE host = 'a'
----
3.000

statement error
UPDATE m SET value = 0 WHERE host = 'a'

statement error
DELETE FROM m WHERE host = 'a'

# Live-tunable OOO (v0.127.0): widen, and the same late point now lands.
statement ok
ALTER TABLE m SET (ooo = 10m)

statement count 1
INSERT INTO m (host, ts, value) VALUES ('a', 1, 9)

query I
SELECT count(*) FROM m
----
4

# --- OOO buffer drain (v0.138.4): a sustained in-window backfill far past
# the 512-sample per-series buffer must land completely (the full buffer
# flush-drains and retries instead of rejecting — it used to bounce
# everything after 512, making the window look like zero).

statement ok
CREATE TIMESERIES TABLE m2 (SERIES KEY (host), OOO 30d)

statement ok
INSERT INTO m2 (host, ts, value) VALUES ('a', 100000000, 999)

statement count 300
INSERT INTO m2 (host, ts, value) VALUES ('a', 1000, 0), ('a', 2000, 1), ('a', 3000, 2), ('a', 4000, 3), ('a', 5000, 4), ('a', 6000, 5), ('a', 7000, 6), ('a', 8000, 7), ('a', 9000, 8), ('a', 10000, 9), ('a', 11000, 10), ('a', 12000, 11), ('a', 13000, 12), ('a', 14000, 13), ('a', 15000, 14), ('a', 16000, 15), ('a', 17000, 16), ('a', 18000, 17), ('a', 19000, 18), ('a', 20000, 19), ('a', 21000, 20), ('a', 22000, 21), ('a', 23000, 22), ('a', 24000, 23), ('a', 25000, 24), ('a', 26000, 25), ('a', 27000, 26), ('a', 28000, 27), ('a', 29000, 28), ('a', 30000, 29), ('a', 31000, 30), ('a', 32000, 31), ('a', 33000, 32), ('a', 34000, 33), ('a', 35000, 34), ('a', 36000, 35), ('a', 37000, 36), ('a', 38000, 37), ('a', 39000, 38), ('a', 40000, 39), ('a', 41000, 40), ('a', 42000, 41), ('a', 43000, 42), ('a', 44000, 43), ('a', 45000, 44), ('a', 46000, 45), ('a', 47000, 46), ('a', 48000, 47), ('a', 49000, 48), ('a', 50000, 49), ('a', 51000, 50), ('a', 52000, 51), ('a', 53000, 52), ('a', 54000, 53), ('a', 55000, 54), ('a', 56000, 55), ('a', 57000, 56), ('a', 58000, 57), ('a', 59000, 58), ('a', 60000, 59), ('a', 61000, 60), ('a', 62000, 61), ('a', 63000, 62), ('a', 64000, 63), ('a', 65000, 64), ('a', 66000, 65), ('a', 67000, 66), ('a', 68000, 67), ('a', 69000, 68), ('a', 70000, 69), ('a', 71000, 70), ('a', 72000, 71), ('a', 73000, 72), ('a', 74000, 73), ('a', 75000, 74), ('a', 76000, 75), ('a', 77000, 76), ('a', 78000, 77), ('a', 79000, 78), ('a', 80000, 79), ('a', 81000, 80), ('a', 82000, 81), ('a', 83000, 82), ('a', 84000, 83), ('a', 85000, 84), ('a', 86000, 85), ('a', 87000, 86), ('a', 88000, 87), ('a', 89000, 88), ('a', 90000, 89), ('a', 91000, 90), ('a', 92000, 91), ('a', 93000, 92), ('a', 94000, 93), ('a', 95000, 94), ('a', 96000, 95), ('a', 97000, 96), ('a', 98000, 97), ('a', 99000, 98), ('a', 100000, 99), ('a', 101000, 100), ('a', 102000, 101), ('a', 103000, 102), ('a', 104000, 103), ('a', 105000, 104), ('a', 106000, 105), ('a', 107000, 106), ('a', 108000, 107), ('a', 109000, 108), ('a', 110000, 109), ('a', 111000, 110), ('a', 112000, 111), ('a', 113000, 112), ('a', 114000, 113), ('a', 115000, 114), ('a', 116000, 115), ('a', 117000, 116), ('a', 118000, 117), ('a', 119000, 118), ('a', 120000, 119), ('a', 121000, 120), ('a', 122000, 121), ('a', 123000, 122), ('a', 124000, 123), ('a', 125000, 124), ('a', 126000, 125), ('a', 127000, 126), ('a', 128000, 127), ('a', 129000, 128), ('a', 130000, 129), ('a', 131000, 130), ('a', 132000, 131), ('a', 133000, 132), ('a', 134000, 133), ('a', 135000, 134), ('a', 136000, 135), ('a', 137000, 136), ('a', 138000, 137), ('a', 139000, 138), ('a', 140000, 139), ('a', 141000, 140), ('a', 142000, 141), ('a', 143000, 142), ('a', 144000, 143), ('a', 145000, 144), ('a', 146000, 145), ('a', 147000, 146), ('a', 148000, 147), ('a', 149000, 148), ('a', 150000, 149), ('a', 151000, 150), ('a', 152000, 151), ('a', 153000, 152), ('a', 154000, 153), ('a', 155000, 154), ('a', 156000, 155), ('a', 157000, 156), ('a', 158000, 157), ('a', 159000, 158), ('a', 160000, 159), ('a', 161000, 160), ('a', 162000, 161), ('a', 163000, 162), ('a', 164000, 163), ('a', 165000, 164), ('a', 166000, 165), ('a', 167000, 166), ('a', 168000, 167), ('a', 169000, 168), ('a', 170000, 169), ('a', 171000, 170), ('a', 172000, 171), ('a', 173000, 172), ('a', 174000, 173), ('a', 175000, 174), ('a', 176000, 175), ('a', 177000, 176), ('a', 178000, 177), ('a', 179000, 178), ('a', 180000, 179), ('a', 181000, 180), ('a', 182000, 181), ('a', 183000, 182), ('a', 184000, 183), ('a', 185000, 184), ('a', 186000, 185), ('a', 187000, 186), ('a', 188000, 187), ('a', 189000, 188), ('a', 190000, 189), ('a', 191000, 190), ('a', 192000, 191), ('a', 193000, 192), ('a', 194000, 193), ('a', 195000, 194), ('a', 196000, 195), ('a', 197000, 196), ('a', 198000, 197), ('a', 199000, 198), ('a', 200000, 199), ('a', 201000, 200), ('a', 202000, 201), ('a', 203000, 202), ('a', 204000, 203), ('a', 205000, 204), ('a', 206000, 205), ('a', 207000, 206), ('a', 208000, 207), ('a', 209000, 208), ('a', 210000, 209), ('a', 211000, 210), ('a', 212000, 211), ('a', 213000, 212), ('a', 214000, 213), ('a', 215000, 214), ('a', 216000, 215), ('a', 217000, 216), ('a', 218000, 217), ('a', 219000, 218), ('a', 220000, 219), ('a', 221000, 220), ('a', 222000, 221), ('a', 223000, 222), ('a', 224000, 223), ('a', 225000, 224), ('a', 226000, 225), ('a', 227000, 226), ('a', 228000, 227), ('a', 229000, 228), ('a', 230000, 229), ('a', 231000, 230), ('a', 232000, 231), ('a', 233000, 232), ('a', 234000, 233), ('a', 235000, 234), ('a', 236000, 235), ('a', 237000, 236), ('a', 238000, 237), ('a', 239000, 238), ('a', 240000, 239), ('a', 241000, 240), ('a', 242000, 241), ('a', 243000, 242), ('a', 244000, 243), ('a', 245000, 244), ('a', 246000, 245), ('a', 247000, 246), ('a', 248000, 247), ('a', 249000, 248), ('a', 250000, 249), ('a', 251000, 250), ('a', 252000, 251), ('a', 253000, 252), ('a', 254000, 253), ('a', 255000, 254), ('a', 256000, 255), ('a', 257000, 256), ('a', 258000, 257), ('a', 259000, 258), ('a', 260000, 259), ('a', 261000, 260), ('a', 262000, 261), ('a', 263000, 262), ('a', 264000, 263), ('a', 265000, 264), ('a', 266000, 265), ('a', 267000, 266), ('a', 268000, 267), ('a', 269000, 268), ('a', 270000, 269), ('a', 271000, 270), ('a', 272000, 271), ('a', 273000, 272), ('a', 274000, 273), ('a', 275000, 274), ('a', 276000, 275), ('a', 277000, 276), ('a', 278000, 277), ('a', 279000, 278), ('a', 280000, 279), ('a', 281000, 280), ('a', 282000, 281), ('a', 283000, 282), ('a', 284000, 283), ('a', 285000, 284), ('a', 286000, 285), ('a', 287000, 286), ('a', 288000, 287), ('a', 289000, 288), ('a', 290000, 289), ('a', 291000, 290), ('a', 292000, 291), ('a', 293000, 292), ('a', 294000, 293), ('a', 295000, 294), ('a', 296000, 295), ('a', 297000, 296), ('a', 298000, 297), ('a', 299000, 298), ('a', 300000, 299)

statement count 300
INSERT INTO m2 (host, ts, value) VALUES ('a', 301000, 300), ('a', 302000, 301), ('a', 303000, 302), ('a', 304000, 303), ('a', 305000, 304), ('a', 306000, 305), ('a', 307000, 306), ('a', 308000, 307), ('a', 309000, 308), ('a', 310000, 309), ('a', 311000, 310), ('a', 312000, 311), ('a', 313000, 312), ('a', 314000, 313), ('a', 315000, 314), ('a', 316000, 315), ('a', 317000, 316), ('a', 318000, 317), ('a', 319000, 318), ('a', 320000, 319), ('a', 321000, 320), ('a', 322000, 321), ('a', 323000, 322), ('a', 324000, 323), ('a', 325000, 324), ('a', 326000, 325), ('a', 327000, 326), ('a', 328000, 327), ('a', 329000, 328), ('a', 330000, 329), ('a', 331000, 330), ('a', 332000, 331), ('a', 333000, 332), ('a', 334000, 333), ('a', 335000, 334), ('a', 336000, 335), ('a', 337000, 336), ('a', 338000, 337), ('a', 339000, 338), ('a', 340000, 339), ('a', 341000, 340), ('a', 342000, 341), ('a', 343000, 342), ('a', 344000, 343), ('a', 345000, 344), ('a', 346000, 345), ('a', 347000, 346), ('a', 348000, 347), ('a', 349000, 348), ('a', 350000, 349), ('a', 351000, 350), ('a', 352000, 351), ('a', 353000, 352), ('a', 354000, 353), ('a', 355000, 354), ('a', 356000, 355), ('a', 357000, 356), ('a', 358000, 357), ('a', 359000, 358), ('a', 360000, 359), ('a', 361000, 360), ('a', 362000, 361), ('a', 363000, 362), ('a', 364000, 363), ('a', 365000, 364), ('a', 366000, 365), ('a', 367000, 366), ('a', 368000, 367), ('a', 369000, 368), ('a', 370000, 369), ('a', 371000, 370), ('a', 372000, 371), ('a', 373000, 372), ('a', 374000, 373), ('a', 375000, 374), ('a', 376000, 375), ('a', 377000, 376), ('a', 378000, 377), ('a', 379000, 378), ('a', 380000, 379), ('a', 381000, 380), ('a', 382000, 381), ('a', 383000, 382), ('a', 384000, 383), ('a', 385000, 384), ('a', 386000, 385), ('a', 387000, 386), ('a', 388000, 387), ('a', 389000, 388), ('a', 390000, 389), ('a', 391000, 390), ('a', 392000, 391), ('a', 393000, 392), ('a', 394000, 393), ('a', 395000, 394), ('a', 396000, 395), ('a', 397000, 396), ('a', 398000, 397), ('a', 399000, 398), ('a', 400000, 399), ('a', 401000, 400), ('a', 402000, 401), ('a', 403000, 402), ('a', 404000, 403), ('a', 405000, 404), ('a', 406000, 405), ('a', 407000, 406), ('a', 408000, 407), ('a', 409000, 408), ('a', 410000, 409), ('a', 411000, 410), ('a', 412000, 411), ('a', 413000, 412), ('a', 414000, 413), ('a', 415000, 414), ('a', 416000, 415), ('a', 417000, 416), ('a', 418000, 417), ('a', 419000, 418), ('a', 420000, 419), ('a', 421000, 420), ('a', 422000, 421), ('a', 423000, 422), ('a', 424000, 423), ('a', 425000, 424), ('a', 426000, 425), ('a', 427000, 426), ('a', 428000, 427), ('a', 429000, 428), ('a', 430000, 429), ('a', 431000, 430), ('a', 432000, 431), ('a', 433000, 432), ('a', 434000, 433), ('a', 435000, 434), ('a', 436000, 435), ('a', 437000, 436), ('a', 438000, 437), ('a', 439000, 438), ('a', 440000, 439), ('a', 441000, 440), ('a', 442000, 441), ('a', 443000, 442), ('a', 444000, 443), ('a', 445000, 444), ('a', 446000, 445), ('a', 447000, 446), ('a', 448000, 447), ('a', 449000, 448), ('a', 450000, 449), ('a', 451000, 450), ('a', 452000, 451), ('a', 453000, 452), ('a', 454000, 453), ('a', 455000, 454), ('a', 456000, 455), ('a', 457000, 456), ('a', 458000, 457), ('a', 459000, 458), ('a', 460000, 459), ('a', 461000, 460), ('a', 462000, 461), ('a', 463000, 462), ('a', 464000, 463), ('a', 465000, 464), ('a', 466000, 465), ('a', 467000, 466), ('a', 468000, 467), ('a', 469000, 468), ('a', 470000, 469), ('a', 471000, 470), ('a', 472000, 471), ('a', 473000, 472), ('a', 474000, 473), ('a', 475000, 474), ('a', 476000, 475), ('a', 477000, 476), ('a', 478000, 477), ('a', 479000, 478), ('a', 480000, 479), ('a', 481000, 480), ('a', 482000, 481), ('a', 483000, 482), ('a', 484000, 483), ('a', 485000, 484), ('a', 486000, 485), ('a', 487000, 486), ('a', 488000, 487), ('a', 489000, 488), ('a', 490000, 489), ('a', 491000, 490), ('a', 492000, 491), ('a', 493000, 492), ('a', 494000, 493), ('a', 495000, 494), ('a', 496000, 495), ('a', 497000, 496), ('a', 498000, 497), ('a', 499000, 498), ('a', 500000, 499), ('a', 501000, 500), ('a', 502000, 501), ('a', 503000, 502), ('a', 504000, 503), ('a', 505000, 504), ('a', 506000, 505), ('a', 507000, 506), ('a', 508000, 507), ('a', 509000, 508), ('a', 510000, 509), ('a', 511000, 510), ('a', 512000, 511), ('a', 513000, 512), ('a', 514000, 513), ('a', 515000, 514), ('a', 516000, 515), ('a', 517000, 516), ('a', 518000, 517), ('a', 519000, 518), ('a', 520000, 519), ('a', 521000, 520), ('a', 522000, 521), ('a', 523000, 522), ('a', 524000, 523), ('a', 525000, 524), ('a', 526000, 525), ('a', 527000, 526), ('a', 528000, 527), ('a', 529000, 528), ('a', 530000, 529), ('a', 531000, 530), ('a', 532000, 531), ('a', 533000, 532), ('a', 534000, 533), ('a', 535000, 534), ('a', 536000, 535), ('a', 537000, 536), ('a', 538000, 537), ('a', 539000, 538), ('a', 540000, 539), ('a', 541000, 540), ('a', 542000, 541), ('a', 543000, 542), ('a', 544000, 543), ('a', 545000, 544), ('a', 546000, 545), ('a', 547000, 546), ('a', 548000, 547), ('a', 549000, 548), ('a', 550000, 549), ('a', 551000, 550), ('a', 552000, 551), ('a', 553000, 552), ('a', 554000, 553), ('a', 555000, 554), ('a', 556000, 555), ('a', 557000, 556), ('a', 558000, 557), ('a', 559000, 558), ('a', 560000, 559), ('a', 561000, 560), ('a', 562000, 561), ('a', 563000, 562), ('a', 564000, 563), ('a', 565000, 564), ('a', 566000, 565), ('a', 567000, 566), ('a', 568000, 567), ('a', 569000, 568), ('a', 570000, 569), ('a', 571000, 570), ('a', 572000, 571), ('a', 573000, 572), ('a', 574000, 573), ('a', 575000, 574), ('a', 576000, 575), ('a', 577000, 576), ('a', 578000, 577), ('a', 579000, 578), ('a', 580000, 579), ('a', 581000, 580), ('a', 582000, 581), ('a', 583000, 582), ('a', 584000, 583), ('a', 585000, 584), ('a', 586000, 585), ('a', 587000, 586), ('a', 588000, 587), ('a', 589000, 588), ('a', 590000, 589), ('a', 591000, 590), ('a', 592000, 591), ('a', 593000, 592), ('a', 594000, 593), ('a', 595000, 594), ('a', 596000, 595), ('a', 597000, 596), ('a', 598000, 597), ('a', 599000, 598), ('a', 600000, 599)

query I
SELECT count(*) FROM m2
----
601

# --- Unbounded LIMIT walks (v0.138.2/.3): oldest-n and latest-n with no
# time bound anchor at the data frontier — the ASC form had no fast path
# at all, and both fell back to a full-range gather (scan-budget death on
# big tables; the walk-engagement proof lives in the Rust tests, the
# result semantics here).

query IR
SELECT ts, value FROM m2 ORDER BY ts LIMIT 2
----
1000 0.000
2000 1.000

query IR
SELECT ts, value FROM m2 ORDER BY ts DESC LIMIT 2
----
100000000 999.000
600000 599.000
